<!ELEMENT alumnos (alumno*)>
<!ELEMENT alumno (nombre, edad, email)>

<!ELEMENT nombre (#PCDATA)>
<!ELEMENT edad (#PCDATA)>
<!ELEMENT email (#PCDATA)>